{
  "formatVersion": "1.0.0",
  "protocolVersion": "2.0",
  "vectorSet": "protocol-negotiation",
  "cases": [
    {
      "id": "protocol-negotiate-request-valid",
      "operation": "schema.validate",
      "input": {
        "schemaName": "negotiate.request",
        "value": {
          "negotiationId": "neg_1",
          "protocol": { "major": 2, "minor": 0 },
          "client": {
            "installationId": "install_1",
            "appVersion": "2.0.0",
            "platform": "android",
            "platformApi": 35
          },
          "features": {
            "auth": ["password", "account-invitation", "refresh", "device-key"],
            "messages": ["chat-v1"],
            "attachments": ["staged-sha256-v1"],
            "events": ["sse-cursor-v1"],
            "deviceRequests": ["risk-queue-v1"]
          },
          "schemaHashes": { "core": "sha256:aaaaaaaaaaaaaaaaaaaaaaaaaaaaaaaaaaaaaaaaaaaaaaaaaaaaaaaaaaaaaaaa" }
        }
      },
      "expected": {
        "outcome": "value",
        "value": { "valid": true }
      }
    },
    {
      "id": "protocol-negotiate-request-invalid-major",
      "operation": "schema.validate",
      "input": {
        "schemaName": "negotiate.request",
        "value": {
          "negotiationId": "neg_1",
          "protocol": { "major": 3, "minor": 0 },
          "client": {
            "installationId": "install_1",
            "appVersion": "2.0.0",
            "platform": "android",
            "platformApi": 35
          },
          "features": {
            "auth": ["password"],
            "messages": ["chat-v1"],
            "attachments": ["staged-sha256-v1"],
            "events": ["sse-cursor-v1"],
            "deviceRequests": ["risk-queue-v1"]
          },
          "schemaHashes": { "core": "sha256:aaaaaaaaaaaaaaaaaaaaaaaaaaaaaaaaaaaaaaaaaaaaaaaaaaaaaaaaaaaaaaaa" }
        }
      },
      "expected": {
        "outcome": "error",
        "code": "SCHEMA_INVALID"
      }
    }
  ]
}
